{"schema":"fleetflight/replay-result@1","counterexample":"cex-6b2a6d1b","model":{"name":"core-ref","version":"1.0","hash":"sha256:d16135e4c764"},"sut":{"id":"firmware-ref@v0.3.3","name":"firmware-ref","version":"v0.3.3"},"cex_sut":"firmware-ref@v0.3.1","same_sut":false,"horizon_ms":4000,"steps":[{"step":0,"t_ms":0,"move":null,"snapshot":{"t_ms":0,"bms":"HEALTHY","bus":"","hub":"ONLINE e1 seq41 DISCHARGE 5000W","inv":"DISCHARGING 5000W seq41 e1","nvm":"e1 next42 no-cmd","hub_bms":"HEALTHY","link":"UP","inv_basis":"HEALTHY","i1_since_ms":null,"i5_since_ms":null,"i4_repeat":null,"injections_left":3},"events":[],"violations":[],"match":false,"diff":["nvm"]},{"step":1,"t_ms":0,"move":{"name":"hub_restart","args":{},"injected":true,"label":"hub_restart"},"snapshot":{"t_ms":0,"bms":"HEALTHY","bus":"","hub":"RESTARTING until 400","inv":"DISCHARGING 5000W seq41 e1","nvm":"e1 next42 no-cmd","hub_bms":"UNKNOWN","link":"UP","inv_basis":"HEALTHY","i1_since_ms":null,"i5_since_ms":null,"i4_repeat":null,"injections_left":2},"events":[{"t_ms":0,"name":"hub_restart","detail":"hub_restart","injected":true}],"violations":[],"match":false,"diff":["nvm"]},{"step":2,"t_ms":50,"move":{"name":"tick","args":{},"injected":false,"label":"tick"},"snapshot":{"t_ms":50,"bms":"HEALTHY","bus":"","hub":"RESTARTING until 400","inv":"DISCHARGING 5000W seq41 e1","nvm":"e1 next42 no-cmd","hub_bms":"UNKNOWN","link":"UP","inv_basis":"HEALTHY","i1_since_ms":null,"i5_since_ms":null,"i4_repeat":null,"injections_left":2},"events":[],"violations":[],"match":false,"diff":["nvm"]},{"step":3,"t_ms":100,"move":{"name":"tick","args":{},"injected":false,"label":"tick"},"snapshot":{"t_ms":100,"bms":"HEALTHY","bus":"","hub":"RESTARTING until 400","inv":"DISCHARGING 5000W seq41 e1","nvm":"e1 next42 no-cmd","hub_bms":"UNKNOWN","link":"UP","inv_basis":"HEALTHY","i1_since_ms":null,"i5_since_ms":null,"i4_repeat":null,"injections_left":2},"events":[],"violations":[],"match":false,"diff":["nvm"]},{"step":4,"t_ms":150,"move":{"name":"tick","args":{},"injected":false,"label":"tick"},"snapshot":{"t_ms":150,"bms":"HEALTHY","bus":"","hub":"RESTARTING until 400","inv":"DISCHARGING 5000W seq41 e1","nvm":"e1 next42 no-cmd","hub_bms":"UNKNOWN","link":"UP","inv_basis":"HEALTHY","i1_since_ms":null,"i5_since_ms":0,"i4_repeat":null,"injections_left":2},"events":[],"violations":[],"match":false,"diff":["nvm"]},{"step":5,"t_ms":200,"move":{"name":"tick","args":{},"injected":false,"label":"tick"},"snapshot":{"t_ms":200,"bms":"HEALTHY","bus":"","hub":"RESTARTING until 400","inv":"DISCHARGING 5000W seq41 e1","nvm":"e1 next42 no-cmd","hub_bms":"UNKNOWN","link":"UP","inv_basis":"HEALTHY","i1_since_ms":null,"i5_since_ms":0,"i4_repeat":null,"injections_left":2},"events":[],"violations":[],"match":false,"diff":["nvm"]},{"step":6,"t_ms":250,"move":{"name":"tick","args":{},"injected":false,"label":"tick"},"snapshot":{"t_ms":250,"bms":"HEALTHY","bus":"","hub":"RESTARTING until 400","inv":"SHUTDOWN seq41 e1","nvm":"e1 next42 no-cmd","hub_bms":"UNKNOWN","link":"UP","inv_basis":"HEALTHY","i1_since_ms":null,"i5_since_ms":null,"i4_repeat":null,"injections_left":2},"events":[{"t_ms":250,"name":"inv_mode","detail":"inverter DISCHARGING → SHUTDOWN","injected":false}],"violations":[],"match":false,"diff":["i5_since_ms","inv","nvm"]},{"step":7,"t_ms":300,"move":{"name":"tick","args":{},"injected":false,"label":"tick"},"snapshot":{"t_ms":300,"bms":"HEALTHY","bus":"","hub":"RESTARTING until 400","inv":"SHUTDOWN seq41 e1","nvm":"e1 next42 no-cmd","hub_bms":"UNKNOWN","link":"UP","inv_basis":"HEALTHY","i1_since_ms":null,"i5_since_ms":null,"i4_repeat":null,"injections_left":2},"events":[],"violations":[],"match":false,"diff":["i5_since_ms","inv","nvm"]},{"step":8,"t_ms":350,"move":{"name":"tick","args":{},"injected":false,"label":"tick"},"snapshot":{"t_ms":350,"bms":"HEALTHY","bus":"","hub":"RESTARTING until 400","inv":"SHUTDOWN seq41 e1","nvm":"e1 next42 no-cmd","hub_bms":"UNKNOWN","link":"UP","inv_basis":"HEALTHY","i1_since_ms":null,"i5_since_ms":null,"i4_repeat":null,"injections_left":2},"events":[],"violations":[],"match":false,"diff":["i5_since_ms","inv","nvm"]},{"step":9,"t_ms":400,"move":{"name":"tick","args":{},"injected":false,"label":"tick"},"snapshot":{"t_ms":400,"bms":"HEALTHY","bus":"cmd@400 hub→inv due 450; cmd@400.2 hub→inv due 450","hub":"DEGRADED e2 seq42 STOP","inv":"SHUTDOWN seq41 e1","nvm":"e2 next43 no-cmd","hub_bms":"UNKNOWN","link":"UP","inv_basis":"HEALTHY","i1_since_ms":null,"i5_since_ms":null,"i4_repeat":null,"injections_left":2},"events":[{"t_ms":400,"name":"hub_boot","detail":"hub up as DEGRADED","injected":false},{"t_ms":400,"name":"send","detail":"cmd@400 CMD hub→inv seq42 STOP 0W e2","injected":false},{"t_ms":400,"name":"refresh","detail":"cmd@400.2 CMD hub→inv seq42 STOP 0W e2","injected":false}],"violations":[],"match":false,"diff":["hub","i5_since_ms","inv","nvm"]},{"step":10,"t_ms":450,"move":{"name":"tick","args":{},"injected":false,"label":"tick"},"snapshot":{"t_ms":450,"bms":"HEALTHY","bus":"","hub":"DEGRADED e2 seq42 STOP","inv":"IDLE seq42 e2","nvm":"e2 next43 no-cmd","hub_bms":"UNKNOWN","link":"UP","inv_basis":"UNKNOWN","i1_since_ms":null,"i5_since_ms":null,"i4_repeat":null,"injections_left":2},"events":[{"t_ms":450,"name":"deliver","detail":"cmd@400 → inv","injected":false},{"t_ms":450,"name":"deliver","detail":"cmd@400.2 → inv","injected":false}],"violations":[],"match":false,"diff":["hub","inv","nvm"]},{"step":11,"t_ms":500,"move":{"name":"tick","args":{},"injected":false,"label":"tick"},"snapshot":{"t_ms":500,"bms":"HEALTHY","bus":"cmd@500 hub→inv due 550","hub":"DEGRADED e2 seq42 STOP","inv":"IDLE seq42 e2","nvm":"e2 next43 no-cmd","hub_bms":"UNKNOWN","link":"UP","inv_basis":"UNKNOWN","i1_since_ms":null,"i5_since_ms":null,"i4_repeat":null,"injections_left":2},"events":[{"t_ms":500,"name":"refresh","detail":"cmd@500 CMD hub→inv seq42 STOP 0W e2","injected":false}],"violations":[],"match":null,"diff":[]},{"step":12,"t_ms":550,"move":{"name":"tick","args":{},"injected":false,"label":"tick"},"snapshot":{"t_ms":550,"bms":"HEALTHY","bus":"","hub":"DEGRADED e2 seq42 STOP","inv":"IDLE seq42 e2","nvm":"e2 next43 no-cmd","hub_bms":"UNKNOWN","link":"UP","inv_basis":"UNKNOWN","i1_since_ms":null,"i5_since_ms":null,"i4_repeat":null,"injections_left":2},"events":[{"t_ms":550,"name":"deliver","detail":"cmd@500 → inv","injected":false}],"violations":[],"match":null,"diff":[]},{"step":13,"t_ms":600,"move":{"name":"tick","args":{},"injected":false,"label":"tick"},"snapshot":{"t_ms":600,"bms":"HEALTHY","bus":"cmd@600 hub→inv due 650","hub":"DEGRADED e2 seq42 STOP","inv":"IDLE seq42 e2","nvm":"e2 next43 no-cmd","hub_bms":"UNKNOWN","link":"UP","inv_basis":"UNKNOWN","i1_since_ms":null,"i5_since_ms":null,"i4_repeat":null,"injections_left":2},"events":[{"t_ms":600,"name":"refresh","detail":"cmd@600 CMD hub→inv seq42 STOP 0W e2","injected":false}],"violations":[],"match":null,"diff":[]},{"step":14,"t_ms":650,"move":{"name":"tick","args":{},"injected":false,"label":"tick"},"snapshot":{"t_ms":650,"bms":"HEALTHY","bus":"","hub":"DEGRADED e2 seq42 STOP","inv":"IDLE seq42 e2","nvm":"e2 next43 no-cmd","hub_bms":"UNKNOWN","link":"UP","inv_basis":"UNKNOWN","i1_since_ms":null,"i5_since_ms":null,"i4_repeat":null,"injections_left":2},"events":[{"t_ms":650,"name":"deliver","detail":"cmd@600 → inv","injected":false}],"violations":[],"match":null,"diff":[]},{"step":15,"t_ms":700,"move":{"name":"tick","args":{},"injected":false,"label":"tick"},"snapshot":{"t_ms":700,"bms":"HEALTHY","bus":"cmd@700 hub→inv due 750","hub":"DEGRADED e2 seq42 STOP","inv":"IDLE seq42 e2","nvm":"e2 next43 no-cmd","hub_bms":"UNKNOWN","link":"UP","inv_basis":"UNKNOWN","i1_since_ms":null,"i5_since_ms":null,"i4_repeat":null,"injections_left":2},"events":[{"t_ms":700,"name":"refresh","detail":"cmd@700 CMD hub→inv seq42 STOP 0W e2","injected":false}],"violations":[],"match":null,"diff":[]},{"step":16,"t_ms":750,"move":{"name":"tick","args":{},"injected":false,"label":"tick"},"snapshot":{"t_ms":750,"bms":"HEALTHY","bus":"","hub":"DEGRADED e2 seq42 STOP","inv":"IDLE seq42 e2","nvm":"e2 next43 no-cmd","hub_bms":"UNKNOWN","link":"UP","inv_basis":"UNKNOWN","i1_since_ms":null,"i5_since_ms":null,"i4_repeat":null,"injections_left":2},"events":[{"t_ms":750,"name":"deliver","detail":"cmd@700 → inv","injected":false}],"violations":[],"match":null,"diff":[]},{"step":17,"t_ms":800,"move":{"name":"tick","args":{},"injected":false,"label":"tick"},"snapshot":{"t_ms":800,"bms":"HEALTHY","bus":"cmd@800 hub→inv due 850","hub":"DEGRADED e2 seq42 STOP","inv":"IDLE seq42 e2","nvm":"e2 next43 no-cmd","hub_bms":"UNKNOWN","link":"UP","inv_basis":"UNKNOWN","i1_since_ms":null,"i5_since_ms":null,"i4_repeat":null,"injections_left":2},"events":[{"t_ms":800,"name":"refresh","detail":"cmd@800 CMD hub→inv seq42 STOP 0W e2","injected":false}],"violations":[],"match":null,"diff":[]},{"step":18,"t_ms":850,"move":{"name":"tick","args":{},"injected":false,"label":"tick"},"snapshot":{"t_ms":850,"bms":"HEALTHY","bus":"","hub":"DEGRADED e2 seq42 STOP","inv":"IDLE seq42 e2","nvm":"e2 next43 no-cmd","hub_bms":"UNKNOWN","link":"UP","inv_basis":"UNKNOWN","i1_since_ms":null,"i5_since_ms":null,"i4_repeat":null,"injections_left":2},"events":[{"t_ms":850,"name":"deliver","detail":"cmd@800 → inv","injected":false}],"violations":[],"match":null,"diff":[]},{"step":19,"t_ms":900,"move":{"name":"tick","args":{},"injected":false,"label":"tick"},"snapshot":{"t_ms":900,"bms":"HEALTHY","bus":"cmd@900 hub→inv due 950","hub":"DEGRADED e2 seq42 STOP","inv":"IDLE seq42 e2","nvm":"e2 next43 no-cmd","hub_bms":"UNKNOWN","link":"UP","inv_basis":"UNKNOWN","i1_since_ms":null,"i5_since_ms":null,"i4_repeat":null,"injections_left":2},"events":[{"t_ms":900,"name":"refresh","detail":"cmd@900 CMD hub→inv seq42 STOP 0W e2","injected":false}],"violations":[],"match":null,"diff":[]},{"step":20,"t_ms":950,"move":{"name":"tick","args":{},"injected":false,"label":"tick"},"snapshot":{"t_ms":950,"bms":"HEALTHY","b